{
 "schema_version": "0.1.0",
 "layer": "RAG retrieval evaluation (offline; generation metrics declared, not measured)",
 "vintage": "2026-10-18",
 "generated_at": "2026-10-27T06:45:17+00:00",
 "generator": {
  "script": "scripts/eval_rag.py",
  "spec": "analysis/specs/rag.yml",
  "git_sha": "7cfa9a7"
 },
 "corpus": {
  "path": "corpus.json",
  "sha256": "5866133acc7b8390685119ec6cff011255c1cebee159d239e43834213a391cee",
  "chunks": 482,
  "vintage": "2026-10-18"
 },
 "eval_set": {
  "path": "eval_set.json",
  "sha256": "fdd810f48b4c516654d700af8fffa388fe55880cda4c8e7160e4a7ab02fc4493",
  "counts": {
   "questions": 22,
   "answerable": 16,
   "refusal_with_reason": 2,
   "out_of_scope": 4
  }
 },
 "k": 5,
 "retrievers": {
  "embedding": {
   "status": "measured",
   "model": "sentence-transformers/multi-qa-MiniLM-L6-cos-v1",
   "path": "embeddings.npz",
   "sha256": "e8cecb35d187630941c5c59648452641b46b1f6a7fd90422c9e166b0ca68ab37",
   "n_chunk_vectors": 482,
   "dim": 384
  },
  "bm25": {
   "status": "measured",
   "k1": 1.5,
   "b": 0.75,
   "why": "The lexical baseline exists so the embedding numbers have something to beat. If BM25 retrieves the gold chunk as often as the embeddings do, the corpus is keyword-addressable and the model is not adding anything — a fact that should be measured rather than assumed, and one this project's chunk sizes make plausible."
  }
 },
 "refusal": {
  "rule": {
   "out_of_scope": "Refuse when the top-1 similarity is below `0.5 x the median top-1 similarity of the answerable eval questions`, **or** when the top-1 chunk is `scope:answer`. The threshold is scale-free and is calibrated on the eval set, which makes refusal recall optimistic; the artifact publishes the threshold, the median it came from and that caveat. BM25 scores are not comparable to cosine, so the baseline reports retrieval only and does not make a refusal decision.",
   "refusal_with_reason": "**Not a score decision at all.** A question the data cannot answer should retrieve the passage that says why with *high* similarity — that is the point of putting the limitations page in the corpus. So this type is measured by whether the reason chunk is in the top 5, and the answer is required to cite it; using \"low similarity\" as the test here would score a well-argued refusal as a failure.",
   "measured": "The first build made exactly that mistake: one score threshold was applied to both kinds of refusal and reported 0 of 2 reason-bearing questions as \"refused\" while the reason chunk was ranked first. The two rules are separate because the two questions are different questions."
  },
  "threshold": 0.291464,
  "median_answerable_top1": 0.582929,
  "applies_to": "embedding retriever only — BM25 scores are unbounded and not comparable to cosine",
  "caveat": "the threshold is calibrated on the answerable eval questions, so refusal recall is optimistic; it is a declared rule with a published number, not a guarantee"
 },
 "metrics": {
  "embedding": {
   "recall_at_k": 0.944444,
   "gold_coverage_at_k": 0.418361,
   "mrr_at_10": 0.714815,
   "n_scored": 18,
   "n_refusal_questions": 2,
   "out_of_scope_refusal": 0.25,
   "answerable_not_refused": 1.0,
   "refusal_reason_recall": 0.5
  },
  "bm25": {
   "recall_at_k": 0.833333,
   "gold_coverage_at_k": 0.382956,
   "mrr_at_10": 0.657407,
   "n_scored": 18,
   "n_refusal_questions": 2,
   "out_of_scope_refusal": null,
   "answerable_not_refused": null,
   "refusal_reason_recall": 0.0
  }
 },
 "gates": {
  "embedding": {
   "recall_at_5": {
    "target": 0.9,
    "measured": 0.944444,
    "met": true
   },
   "refusal_reason_recall": {
    "target": 1.0,
    "measured": 0.5,
    "met": false
   },
   "out_of_scope_refusal": {
    "target": 1.0,
    "measured": 0.25,
    "met": false
   },
   "answerable_not_refused": {
    "target": 1.0,
    "measured": 1.0,
    "met": true
   }
  },
  "bm25": {
   "recall_at_5": {
    "target": 0.9,
    "measured": 0.833333,
    "met": false
   },
   "refusal_reason_recall": {
    "target": 1.0,
    "measured": 0.0,
    "met": false
   },
   "out_of_scope_refusal": {
    "target": 1.0,
    "measured": null,
    "met": null
   },
   "answerable_not_refused": {
    "target": 1.0,
    "measured": null,
    "met": null
   }
  }
 },
 "answer_shape": {
  "status": "not_measured",
  "why": "the post-check (interval + identifying assumption + citation, R-04) runs on assembled answers and there is no generation step in this repository yet. The eval set carries `must_contain` needles per question so the check is ready to run with the app.",
  "declared_in": [
   "question",
   "estimate_with_interval",
   "identifying_assumption",
   "what_it_cannot_rule_out",
   "citation"
  ]
 },
 "ragas": {
  "status": "not_run",
  "why": "This block describes the `ragas` *library*, which is not installed in this repository or on this machine: installing it would add a dependency tree to a project whose answering path deliberately has none. The four metric definitions it implements — faithfulness, answer relevancy, context precision and context recall — are implemented in `scripts/eval_answer_quality.py` and measured with a judge model in `answer_quality_eval.json`. Those scores are not comparable to a library run, because the prompt, the decomposition and the call pattern are this repository's.",
  "measured_elsewhere": "registry/rag/2026-10-18/answer_quality_eval.json",
  "metadata": [
   "question",
   "contexts",
   "answer",
   "ground_truth"
  ]
 },
 "questions": [
  {
   "id": "q01_fatalities_elasticity",
   "type": "answerable",
   "retrieved": [
    {
     "chunk_id": "estimate:fatalities__A",
     "score": 0.629271
    },
    {
     "chunk_id": "card:fatalities__B#p6",
     "score": 0.614327
    },
    {
     "chunk_id": "card:fatalities__A#p6",
     "score": 0.59542
    },
    {
     "chunk_id": "result:A",
     "score": 0.578616
    },
    {
     "chunk_id": "estimate:incidents__A",
     "score": 0.567862
    }
   ],
   "top1_score": 0.629271,
   "first_gold_rank": 3,
   "refused": false,
   "bm25": {
    "id": "q01_fatalities_elasticity",
    "type": "answerable",
    "retrieved": [
     {
      "chunk_id": "result:B",
      "score": 12.68457
     },
     {
      "chunk_id": "estimate:fatalities__B",
      "score": 12.389474
     },
     {
      "chunk_id": "card:fatalities__B#p6",
      "score": 11.853696
     },
     {
      "chunk_id": "card:fatalities__A#p6",
      "score": 10.472523
     },
     {
      "chunk_id": "card:fatalities__C#p6",
      "score": 10.007329
     }
    ],
    "top1_score": 12.68457,
    "first_gold_rank": 4
   }
  },
  {
   "id": "q02_fatalities_identified",
   "type": "answerable",
   "retrieved": [
    {
     "chunk_id": "card:fatalities__A#p6",
     "score": 0.63179
    },
    {
     "chunk_id": "card:fatalities__B#p6",
     "score": 0.570857
    },
    {
     "chunk_id": "card:fatalities__C#p6",
     "score": 0.545805
    },
    {
     "chunk_id": "doc:events#s05#p6",
     "score": 0.529658
    },
    {
     "chunk_id": "estimate:fatalities__A",
     "score": 0.528608
    }
   ],
   "top1_score": 0.63179,
   "first_gold_rank": 1,
   "refused": false,
   "bm25": {
    "id": "q02_fatalities_identified",
    "type": "answerable",
    "retrieved": [
     {
      "chunk_id": "doc:registry#s02#p2",
      "score": 8.59896
     },
     {
      "chunk_id": "result:A",
      "score": 7.819284
     },
     {
      "chunk_id": "doc:limitations#s05#p2",
      "score": 7.203638
     },
     {
      "chunk_id": "card:fatalities__A#p7",
      "score": 7.170704
     },
     {
      "chunk_id": "card:incidents__A#p5",
      "score": 6.156103
     }
    ],
    "top1_score": 8.59896,
    "first_gold_rank": 4
   }
  },
  {
   "id": "q03_incidents_interval",
   "type": "answerable",
   "retrieved": [
    {
     "chunk_id": "result:A#p2",
     "score": 0.544011
    },
    {
     "chunk_id": "doc:limitations#s05",
     "score": 0.500362
    },
    {
     "chunk_id": "card:incidents__A#p5",
     "score": 0.46974
    },
    {
     "chunk_id": "card:incidents__B",
     "score": 0.447234
    },
    {
     "chunk_id": "estimate:incidents__A",
     "score": 0.443252
    }
   ],
   "top1_score": 0.544011,
   "first_gold_rank": 3,
   "refused": false,
   "bm25": {
    "id": "q03_incidents_interval",
    "type": "answerable",
    "retrieved": [
     {
      "chunk_id": "card:incidents__A#p5",
      "score": 15.560308
     },
     {
      "chunk_id": "doc:design-memo#s07",
      "score": 12.924098
     },
     {
      "chunk_id": "result:A#p2",
      "score": 12.561665
     },
     {
      "chunk_id": "estimate:incidents__B",
      "score": 12.286519
     },
     {
      "chunk_id": "estimate:incidents__A",
      "score": 12.074113
     }
    ],
    "top1_score": 15.560308,
    "first_gold_rank": 1
   }
  },
  {
   "id": "q04_oil_to_states",
   "type": "answerable",
   "retrieved": [
    {
     "chunk_id": "result:B",
     "score": 0.679299
    },
    {
     "chunk_id": "doc:estimates#s02#p5",
     "score": 0.578415
    },
    {
     "chunk_id": "doc:estimates#s02#p11",
     "score": 0.575699
    },
    {
     "chunk_id": "doc:estimates#s02#p12",
     "score": 0.509923
    },
    {
     "chunk_id": "doc:estimates#s02#p9",
     "score": 0.497386
    }
   ],
   "top1_score": 0.679299,
   "first_gold_rank": 1,
   "refused": false,
   "bm25": {
    "id": "q04_oil_to_states",
    "type": "answerable",
    "retrieved": [
     {
      "chunk_id": "result:B",
      "score": 18.011322
     },
     {
      "chunk_id": "doc:dags#node-vocabulary#p2",
      "score": 12.205095
     },
     {
      "chunk_id": "doc:estimates#s02#p9",
      "score": 11.20192
     },
     {
      "chunk_id": "doc:estimates#s02#p11",
      "score": 10.411028
     },
     {
      "chunk_id": "doc:events#s03#p2",
      "score": 9.747574
     }
    ],
    "top1_score": 18.011322,
    "first_gold_rank": 1
   }
  },
  {
   "id": "q05_design_b_robust",
   "type": "answerable",